id,title,slug,description,created_at,updated_at,deleted_at,experience,professions,requirement_list,language,contract_type,employment_type,start_date_expected,work_schedule,travel_scope,progress,work_location,work_location_coordinates,salary,managers,manager_email_alerts,video,illustration,survey,organization,visibility,tags
103,AVOCAT collaborateur (H/F) en Droit Social – Conseil et Contentieux,ChD3H9jhhdZZbZ9pZmKD,"Missions :

Vous interviendrez, aux côtés de notre associée en charge de ce service au sein de notre structure en conseil et contentieux en droit du travail individuel et collectif.

Vous intégrerez une équipe d’avocats et d’assistantes juridiques.

Vous bénéficierez des programmes de formation mis en œuvre par le cabinet et par l’Ordre.

Vous aurez en charge le Conseil et la défense des clients du cabinet en droit social et en droit de la Sécurité Sociale.

Vous assisterez aux rendez-vous et échanges téléphoniques avec les clients du Cabinet.

Vous assurerez leur défense devant les juridictions.


Profil :

Titulaire du CAPA, Master 2 en droit social apprécié, bonnes qualités rédactionnelles, esprit de synthèse, rigueur, curiosité, adaptabilité et bon esprit d’équipe. 

Bonne pratique des outils informatiques, PolyOffice et PolyActe.",2024-09-06T17:15:42.000Z,2025-12-16T07:39:44.000Z,,-1,"[{'id': 8252, 'name': 'Avocat / Avocate'}]",,fr,cdi,['full-time'],,,['no'],published,"{'address': {'village': 'Nantes', 'municipality': 'Loire-Atlantique', 'county': 'Loire-Atlantique', 'state': 'Pays de la Loire', 'country': 'France', 'country_code': 'fr', 'postcode': '44000'}, 'display_name': ""5 Rue de l'Hôtel de Ville, 44000 Nantes, France""}","47.2177277,-1.5554932",,['Zainab Limana (Groupe: Smart Profil) - z.limama@smart-profil.com'],False,,"{'original_path': '01JM28KG002WMGRCYZE79MHE4K.jpg', 'srcset': '[{""path"":""images\\/resized\\/300_30a3a9f51dcf708aa351d069fd414d16148ea711f3bd9b708167da0518edf3cc.jpg"",""size"":""300w""},{""path"":""images\\/resized\\/600_30a3a9f51dcf708aa351d069fd414d16148ea711f3bd9b708167da0518edf3cc.jpg"",""size"":""600w""},{""path"":""images\\/resized\\/900_30a3a9f51dcf708aa351d069fd414d16148ea711f3bd9b708167da0518edf3cc.jpg"",""size"":""900w""}]'}",,"{'client': 'Smart Profil', 'group': {'id': 2, 'name': 'Smart Profil', 'description': ""Smart Profil est un cabinet de recrutement généraliste qui accompagne les entreprises et les candidats sur toute la France. Nous offrons des solutions de recrutement et d'accompagnement RH sur mesure pour répondre aux besoins spécifiques de chaque entreprise et de chaque candidat.""}, 'brand': None, 'unit': None}","{'public_show_entity': True, 'platforms': {'career_site': True, 'linked_in': None, 'indeed': True, 'jobijoba': True, 'france_travail': None, 'hellowork': True, 'adzuna': None, 'meteojob': True}}","{'public': [], 'private': []}"
104,AVOCAT collaborateur (H/F) en Droit des Affaires / Droit des Sociétés – Junior et Senior,fC0SbwIAnBq6AkFoCSDm,"Missions


Sous la supervision d’un associé du cabinet, vous interviendrez auprès d’une clientèle de PME et de groupes de sociétés sur des missions de conseil en droit des sociétés, droit fiscal et droit des affaires.

Vos principales missions seront les suivantes :

rédaction des documents contractuels lors des opérations d’acquisitions et ou de cessions de sociétés, cessions de fonds de commerce, mise en place des garanties de passif et autres garanties, pactes d’actionnaires, etc.,
rédaction de la documentation juridique pour la réalisation d’opérations sur le capital, TUP, fusions, apports partiel d’actifs, etc.,
établissement de tous les actes juridiques liés à la vie des sociétés : création de sociétés, cession de parts, etc.,
droit fiscal (consultations, contentieux, etc.),
droit patrimonial,
rédaction de contrats commerciaux, baux commerciaux.

Profil
Titulaire du CAPA et diplômé(e) d’un Master 2 en droit des affaires (DJCE apprécié), vous êtes rigoureux(euse), doté d’un sens du service et vous savez faire preuve de curiosité, d’adaptabilité et d’un bon esprit d’équipe. Vous avez de solides connaissances en comptabilité et fiscalité. 

Bonne pratique des outils informatiques, PolyOffice et PolyActe.

Vos compétences techniques et votre capacité d’intégration, nous permettront de faire évoluer vos responsabilités.",2024-09-11T15:07:04.000Z,2025-12-16T07:39:44.000Z,,3,"[{'id': 8254, 'name': ""Avocat / Avocate d'affaires""}]",,fr,cdi,['full-time'],,,['no'],published,"{'address': {'village': 'Nantes', 'municipality': 'Loire-Atlantique', 'county': 'Loire-Atlantique', 'state': 'Pays de la Loire', 'country': 'France', 'country_code': 'fr', 'postcode': '44000'}, 'display_name': '29 Rue de Strasbourg, 44000 Nantes, France'}","47.2186371,-1.5541362",,['zainab.limama@gmail.com'],False,,"{'original_path': '01JM1XD1JVT5YPBZRXWCYAF63A.jpg', 'srcset': '[{""path"":""images\\/resized\\/300_32685b02eeb32eb65355713f81a208464c7f16acbb22f01ffc67c397352c3136.jpg"",""size"":""300w""},{""path"":""images\\/resized\\/600_32685b02eeb32eb65355713f81a208464c7f16acbb22f01ffc67c397352c3136.jpg"",""size"":""600w""},{""path"":""images\\/resized\\/900_32685b02eeb32eb65355713f81a208464c7f16acbb22f01ffc67c397352c3136.jpg"",""size"":""900w""}]'}",,"{'client': 'Smart Profil', 'group': {'id': 2, 'name': 'Smart Profil', 'description': ""Smart Profil est un cabinet de recrutement généraliste qui accompagne les entreprises et les candidats sur toute la France. Nous offrons des solutions de recrutement et d'accompagnement RH sur mesure pour répondre aux besoins spécifiques de chaque entreprise et de chaque candidat.""}, 'brand': None, 'unit': None}","{'public_show_entity': True, 'platforms': {'career_site': True, 'linked_in': None, 'indeed': True, 'jobijoba': True, 'france_travail': None, 'hellowork': True, 'adzuna': None, 'meteojob': True}}","{'public': [], 'private': []}"
108,Mécanicien Agricole ,UMWgVDpzxFk9jwb0BWny,"Smart Profil recherche pour son client un Mécanicien Agricole (H/F) expérimenté pour renforcer l'équipe technique.

Vos missions :
Assurer la maintenance quotidienne des moteurs agricoles (nettoyage, graissage, niveaux d'huile, etc.)
Vérifier l'état et le bon fonctionnement des machines avant utilisation (systèmes d'éclairage, sécurité, systèmes hydrauliques et électriques)
Réaliser l'entretien courant des machines (vidanges, changements de filtres)
Diagnostiquer les pannes et anomalies des moteurs agricoles
Réparer ou remplacer les éléments défectueux et effectuer des essais de fonctionnement après intervention
Tenir à jour les documents de suivi des machines (carnet d'entretien)
Participer à la gestion de l'atelier : entretien des outils, gestion des stocks, rangement
Profil recherché :
Formation type CAPA, BTS ou BTSA dans le domaine de la maintenance des matériels agricoles
Connaissances en systèmes hydrauliques, électriques et informatiques embarqués
Sens de l'analyse, capacité à diagnostiquer rapidement et habileté manuelle
Endurance physique pour intervenir sur des machines lourdes
Esprit d'équipe et rigueur dans l'organisation du travail
Conditions :
Travail sous la supervision du chef d'atelier, principalement en hangar, avec des interventions possibles sur le terrain.
Perspectives d'évolution vers un poste de chef d'atelier selon l'expérience.
Rejoignez l'aventure et mettez vos compétences au service de la performance agricole !

",2024-10-09T04:26:53.000Z,2025-12-16T07:39:45.000Z,,3,"[{'id': 7172, 'name': 'Mécanicien / Mécanicienne agricole'}]",,fr,cdi,['full-time'],Dés que possible ,,['no'],published,"{'address': {'village': 'Arnas', 'municipality': 'Rhône', 'county': 'Rhône', 'state': 'Auvergne-Rhône-Alpes', 'country': 'France', 'country_code': 'fr', 'postcode': '69400'}, 'display_name': '11 Rue du Stade, 69400 Arnas, France'}","46.0235247,4.7071167",,['s.gentil@smart-profil.com'],True,,"{'original_path': '01JA7HYG2NXPBFWPYF2TMM0D9X.jpg', 'srcset': '[{""path"":""images\\/resized\\/300_6835d788d089aa865de5031a446c7015f7e54b18650072d322549ffaf755f82a.jpg"",""size"":""300w""},{""path"":""images\\/resized\\/600_6835d788d089aa865de5031a446c7015f7e54b18650072d322549ffaf755f82a.jpg"",""size"":""600w""},{""path"":""images\\/resized\\/900_6835d788d089aa865de5031a446c7015f7e54b18650072d322549ffaf755f82a.jpg"",""size"":""900w""}]'}",,"{'client': 'Smart Profil', 'group': {'id': 2, 'name': 'Smart Profil', 'description': ""Smart Profil est un cabinet de recrutement généraliste qui accompagne les entreprises et les candidats sur toute la France. Nous offrons des solutions de recrutement et d'accompagnement RH sur mesure pour répondre aux besoins spécifiques de chaque entreprise et de chaque candidat.""}, 'brand': None, 'unit': None}","{'public_show_entity': False, 'platforms': {'career_site': True, 'linked_in': None, 'indeed': False, 'jobijoba': False, 'france_travail': None, 'hellowork': True, 'adzuna': None, 'meteojob': False}}","{'public': [], 'private': []}"
110,Chef de culture en pépinière (H/F),5y1GN5X2FYqOG1xqZSMA,"Smart Profil recrute pour son client un Chef d'équipe en Pépinière (H/F) pour encadrer et optimiser les opérations dans une pépinière en pleine croissance.

Vos missions :
Encadrer et superviser une équipe de travailleurs horticoles
Organiser et planifier les activités de production et d’entretien des plantes (arrosage, fertilisation, taille)
Assurer la qualité des plants produits et veiller à leur bonne croissance
Gérer les stocks de matériels et de produits horticoles
Garantir la bonne application des normes de sécurité et des pratiques environnementales durables
Participer activement aux opérations de plantation, de transplantation et d’entretien des végétaux

Profil recherché :
Vous avez une formation en horticulture ou en gestion de production végétale
Expérience confirmée en encadrement d’équipe dans le secteur horticole
Connaissances en gestion des cultures sous serre et en plein champ
Esprit d’équipe, rigueur et sens de l’organisation

Conditions :
Travail en extérieur au sein d’une équipe dynamique et passionnée.
Vous aimez la nature et souhaitez jouer un rôle clé dans le développement d’une pépinière ? Postulez dès maintenant !",2024-10-15T08:22:51.000Z,2025-12-16T07:39:45.000Z,,3,"[{'id': 489, 'name': 'Pépiniériste'}, {'id': 484, 'name': 'Ouvrier / Ouvrière pépiniériste'}]",,fr,cdi,['full-time'],dés que possible ,,['no'],published,"{'address': {'village': 'Arnas', 'municipality': 'Rhône', 'county': 'Rhône', 'state': 'Auvergne-Rhône-Alpes', 'country': 'France', 'country_code': 'fr', 'postcode': '69400'}, 'display_name': '11 Rue du Stade, 69400 Arnas, France'}","46.0235247,4.7071167",,"['s.gentil@smart-profil.com', 'z.limama@smart-profil.com']",True,,"{'original_path': '01JA7MBN5VTAFRGRC4Z8CHVAAT.jpg', 'srcset': '[{""path"":""images\\/resized\\/300_7bf5db623c01b9dd6d0ebb3d57d1b9c7020a0ca82d0e9e2972a269cf0dca77f6.jpg"",""size"":""300w""},{""path"":""images\\/resized\\/600_7bf5db623c01b9dd6d0ebb3d57d1b9c7020a0ca82d0e9e2972a269cf0dca77f6.jpg"",""size"":""600w""},{""path"":""images\\/resized\\/900_7bf5db623c01b9dd6d0ebb3d57d1b9c7020a0ca82d0e9e2972a269cf0dca77f6.jpg"",""size"":""900w""}]'}",,"{'client': 'Smart Profil', 'group': {'id': 2, 'name': 'Smart Profil', 'description': ""Smart Profil est un cabinet de recrutement généraliste qui accompagne les entreprises et les candidats sur toute la France. Nous offrons des solutions de recrutement et d'accompagnement RH sur mesure pour répondre aux besoins spécifiques de chaque entreprise et de chaque candidat.""}, 'brand': None, 'unit': None}","{'public_show_entity': False, 'platforms': {'career_site': True, 'linked_in': False, 'indeed': True, 'jobijoba': True, 'france_travail': False, 'hellowork': True, 'adzuna': False, 'meteojob': False}}","{'public': [], 'private': []}"
117,Chef de culture en pépinière (H/F),xFTU65yejaL7FYt3CIwT,"Smart Profil recrute pour son client un Chef d'équipe en Pépinière (H/F) pour encadrer et optimiser les opérations dans une pépinière en pleine croissance.

Vos missions :
Encadrer et superviser une équipe de travailleurs horticoles
Organiser et planifier les activités de production et d’entretien des plantes (arrosage, fertilisation, taille)
Assurer la qualité des plants produits et veiller à leur bonne croissance
Gérer les stocks de matériels et de produits horticoles
Garantir la bonne application des normes de sécurité et des pratiques environnementales durables
Participer activement aux opérations de plantation, de transplantation et d’entretien des végétaux

Profil recherché :
Vous avez une formation en horticulture ou en gestion de production végétale
Expérience confirmée en encadrement d’équipe dans le secteur horticole
Connaissances en gestion des cultures sous serre et en plein champ
Esprit d’équipe, rigueur et sens de l’organisation

Conditions :
Travail en extérieur au sein d’une équipe dynamique et passionnée.
Vous aimez la nature et souhaitez jouer un rôle clé dans le développement d’une pépinière ? Postulez dès maintenant !",2024-11-25T14:01:46.000Z,2025-12-16T07:39:45.000Z,,3,"[{'id': 489, 'name': 'Pépiniériste'}, {'id': 484, 'name': 'Ouvrier / Ouvrière pépiniériste'}]",,fr,cdi,['full-time'],dés que possible ,,['no'],published,"{'address': {'village': 'Arnas', 'municipality': 'Rhône', 'county': 'Rhône', 'state': 'Auvergne-Rhône-Alpes', 'country': 'France', 'country_code': 'fr', 'postcode': '69400'}, 'display_name': '11 Rue du Stade, 69400 Arnas, France'}","46.0235247,4.7071167",,['s.gentil@smart-profil.com'],True,,"{'original_path': '01JA7MBN5VTAFRGRC4Z8CHVAAT.jpg', 'srcset': '[{""path"":""images\\/resized\\/300_7bf5db623c01b9dd6d0ebb3d57d1b9c7020a0ca82d0e9e2972a269cf0dca77f6.jpg"",""size"":""300w""},{""path"":""images\\/resized\\/600_7bf5db623c01b9dd6d0ebb3d57d1b9c7020a0ca82d0e9e2972a269cf0dca77f6.jpg"",""size"":""600w""},{""path"":""images\\/resized\\/900_7bf5db623c01b9dd6d0ebb3d57d1b9c7020a0ca82d0e9e2972a269cf0dca77f6.jpg"",""size"":""900w""}]'}",,"{'client': 'Smart Profil', 'group': {'id': 2, 'name': 'Smart Profil', 'description': ""Smart Profil est un cabinet de recrutement généraliste qui accompagne les entreprises et les candidats sur toute la France. Nous offrons des solutions de recrutement et d'accompagnement RH sur mesure pour répondre aux besoins spécifiques de chaque entreprise et de chaque candidat.""}, 'brand': None, 'unit': None}","{'public_show_entity': False, 'platforms': {'career_site': True, 'linked_in': False, 'indeed': False, 'jobijoba': False, 'france_travail': False, 'hellowork': True, 'adzuna': False, 'meteojob': False}}","{'public': [], 'private': []}"
119,Pépiniériste H/F,byU8H7fTcViXkAFbNrCo,"

En tant que pépiniériste, vous jouerez un rôle clé dans la conduite et l'élevage des végétaux d'extérieur, notamment les arbustes et les arbres d'ornement.

**Responsabilités :**

- Participez activement à la mise en place des cycles de production en utilisant divers équipements, de la mécanique à l'hydraulique et parfois des automates programmables.
- Contribuez aux amendements des cultures et préparez le sol en installant les substrats nécessaires à la fertilisation.
- Surveillez attentivement l'état des parcelles pour identifier et traiter les problèmes potentiels, tels que les maladies, les parasites, les carences ou les dérives de la conduite des végétaux.
- Façonnez les plantes grâce à des interventions variées, notamment le palissage, la taille, le pincement et le tuteurage.
- Réalisez des opérations de multiplication des végétaux par greffage.
- Appliquez avec précision les traitements phytosanitaires et les fertilisants nécessaires.
- Entretenez les parcelles en effectuant le binage mécanique, le désherbage et le buttage.

**Conditions d'Exercice :**

- Vous travaillerez en plein air au sein d'une pépinière d'élevage.
- Vous pouvez être amené à travailler seul ou en équipe.
- Vos horaires seront réguliers, mais des heures supplémentaires pourront être nécessaires lors des périodes de production et de vente intensives, en particulier au printemps et en automne.

Nous sommes déterminés à offrir un environnement de travail enrichissant et à promouvoir la croissance professionnelle de nos employés. Rejoignez-nous et contribuez à la beauté de notre environnement naturel tout en développant votre carrière dans le domaine de la pépinière.

Par la suite, nous vous accompagnons dans le développement de vos compétences afin d'accéder au poste de chef d'équipe pépiniériste.

**Le profil recherché**

**Compétences et Qualités Requises :**

- Connaissance approfondie des végétaux, des ennemis des cultures et des moyens de lutte, y compris les produits phytosanitaires.
- Maîtrise des techniques de culture et de multiplication.
- Capacité à utiliser des engins agricoles, ou disposition à être formé à leur utilisation.
- Adaptabilité à l'évolution des gammes de produits et capacité à mémoriser et à s'adapter rapidement.

**Formation :**

- CAPA Productions horticoles, spécialité pépinières.
- Bac professionnel Productions horticoles, spécialité pépinières.",2024-11-25T14:37:49.000Z,2025-12-16T07:39:45.000Z,,5,"[{'id': 198, 'name': 'Aide-pépiniériste'}]",,fr,cdi,['full-time'],2024-03-11,,['no'],published,"{'address': {'village': 'Arnas', 'municipality': 'Rhône', 'county': 'Rhône', 'state': 'Auvergne-Rhône-Alpes', 'country': 'France', 'country_code': 'fr', 'postcode': '69400'}, 'display_name': '4 Imp. Suzanne Valadon, 69400 Arnas, France'}","46.023687610000000,4.708011806928800",,['dev@ss2i-digital.fr'],True,,"{'original_path': '01JDHW5K8N26CJZ8W83AG2207W.jpg', 'srcset': '[{""path"":""images\\/resized\\/300_7f559bbe6112a6da63cf52ea5a193d4a172329b18c0c0c45266fc5ad5d89e84a.jpg"",""size"":""300w""},{""path"":""images\\/resized\\/600_7f559bbe6112a6da63cf52ea5a193d4a172329b18c0c0c45266fc5ad5d89e84a.jpg"",""size"":""600w""},{""path"":""images\\/resized\\/900_7f559bbe6112a6da63cf52ea5a193d4a172329b18c0c0c45266fc5ad5d89e84a.jpg"",""size"":""900w""}]'}",,"{'client': 'Smart Profil', 'group': {'id': 2, 'name': 'Smart Profil', 'description': ""Smart Profil est un cabinet de recrutement généraliste qui accompagne les entreprises et les candidats sur toute la France. Nous offrons des solutions de recrutement et d'accompagnement RH sur mesure pour répondre aux besoins spécifiques de chaque entreprise et de chaque candidat.""}, 'brand': None, 'unit': None}","{'public_show_entity': False, 'platforms': {'career_site': True, 'linked_in': True, 'indeed': False, 'jobijoba': False, 'france_travail': True, 'hellowork': True, 'adzuna': False, 'meteojob': False}}","{'public': [], 'private': []}"
131,Technicien froid commercial,bxKKqbIMhlGEfgfXUtPf,"SMART PROFIL recherche pour son client, leader depuis 90 ans dans le froid et la climatisation et spécialisée dans l’installation et la maintenance d’équipement frigorifique et de cuisine professionnelle, un(e) dépanneur maintenance cuisiniste.

Rattaché au service maintenance, vous serez amené à faire à des interventions de maintenance curative et préventive auprès d'une clientèle de collectivité, restauration professionnelle ou collective.

Vous aurez en charge principalement les missions suivantes :

Identifier les causes d’un dysfonctionnement ou d’une panne sur une installation et préconiser les solutions.
Réaliser et suivre les opérations de dépannage, maintenance et travaux de réparation sur du matériel de type cuisson, petit froid, lavage, matériel de préparation, vitrine réfrigérée.
Compte rendu des interventions réalisées.
Suivi du parc client.

Descriptif du profil :
De formation technique dans le domaine du froid, cuisson, buanderie, laverie,
électrotechnicien. Vous justifiez d’une expérience significative de 3 ans minimum.
Homme ou femme de terrain, vous êtes autonome, sérieux, rigoureux, et vous avez
le sens du service client.
Si ces qualités vous caractérisent, alors vous êtes le nouveau talent de l’équipe.

Indispensable:

Nécessité d'avoir le certificat de manipulation des fluides frigorigènes

",2025-01-30T09:43:50.000Z,2025-12-16T07:39:45.000Z,,3,"[{'id': 1549, 'name': 'Cuisiniste'}, {'id': 6898, 'name': 'Technicien-cuisiniste / Technicienne-cuisiniste en cuisines professionnelles'}, {'id': 6871, 'name': ""Agent / Agente d'encadrement de maintenance en froid et climatisation""}]",,fr,cdi,['full-time'],Dès que possible,,['department'],published,"{'address': {'village': 'Bezannes', 'municipality': 'Marne', 'county': 'Marne', 'state': 'Grand Est', 'country': 'France', 'country_code': 'fr', 'postcode': '51430'}, 'display_name': '3 Rue Source de Muire, 51430 Bezannes, France'}","49.2195271,3.9864282",,['Zainab Limana (Groupe: Smart Profil) - z.limama@smart-profil.com'],True,,"{'original_path': '01JJV9GTX4DRY5NGK6PDBNVK3K.jpeg', 'srcset': '[{""path"":""images\\/resized\\/300_61e47e10caa14caff3ed4c7c4d54e254e29a249642f94a08f2c683508812ad7c.jpeg"",""size"":""300w""},{""path"":""images\\/resized\\/600_61e47e10caa14caff3ed4c7c4d54e254e29a249642f94a08f2c683508812ad7c.jpeg"",""size"":""600w""},{""path"":""images\\/resized\\/900_61e47e10caa14caff3ed4c7c4d54e254e29a249642f94a08f2c683508812ad7c.jpeg"",""size"":""900w""}]'}",,"{'client': 'Smart Profil', 'group': {'id': 2, 'name': 'Smart Profil', 'description': ""Smart Profil est un cabinet de recrutement généraliste qui accompagne les entreprises et les candidats sur toute la France. Nous offrons des solutions de recrutement et d'accompagnement RH sur mesure pour répondre aux besoins spécifiques de chaque entreprise et de chaque candidat.""}, 'brand': None, 'unit': None}","{'public_show_entity': True, 'platforms': {'career_site': True, 'linked_in': False, 'indeed': False, 'jobijoba': False, 'france_travail': False, 'hellowork': True, 'adzuna': False, 'meteojob': False}}","{'public': [], 'private': []}"
